{
  "subdomain": "test.apidocumentation.com",
  "guides": [
    {
      "name": "First Guide",
      "sidebar": [
        {
          "path": "src/page-one.md",
          "type": "page",
          "name": "My First Page!!"
        },
        {
          "path": "src/page-two.md",
          "type": "page",
          "name": "Page title in the config!",
          "children": [
            {
              "name": "First Folder",
              "type": "folder",
              "children": [
                {
                  "url": "https://scalar.com/",
                  "type": "link",
                  "name": "Nested link"
                }
              ]
            }
          ]
        },
        {
          "path": "src/page-large.md",
          "type": "page",
          "children": [
            {
              "url": "https://scalar.com/",
              "type": "link",
              "name": "Nested link"
            }
          ]
        },
        {
          "path": "src/page-test.md",
          "type": "page",
          "name": "A weird test page!",
          "children": [
            {
              "path": "src/page-nested.md",
              "type": "page",
              "name": "Nested page"
            }
          ]
        }
      ]
    }
  ],
  "references": [],
  "siteConfig": {
    "footer": "<footer>\r\n  <p>This is the testing footer!!</p>\r\n</footer>",
    "theme": "some-theme"
  }
}
